influencer,comment,sentiment,likes,shares,platform,cost,engagement,roi
 EchoingSoul     ," Loneliness echoes in empty spaces, yearning for connection.", Loneliness ,30.0,15.0, Instagram ,3000.0,75.0,0.025
 PoisonedMind    ," Jealousy poisons my thoughts, resentment brewing within.", Jealousy    ,15.0,8.0, Facebook ,3000.0,39.0,0.013
 UnforgivingSoul  ," Resentment festers, a wound that refuses to heal.  ", Resentment      ,20.0,10.0, Twitter  ,3000.0,50.0,0.016666666666666666
 ThunderingMind   ," Frustration escalates, a thunderstorm of emotions. ", Frustration     ,25.0,12.0, Instagram ,3000.0,61.0,0.02033333333333333
 StagnantHeart    ," Boredom lingers, a stagnant pool of indifference.  ", Boredom         ,15.0,7.0, Facebook ,3000.0,36.0,0.012
 InquisitiveMind   ," Embarking on a journey of discovery, fueled by curiosity and a thirst for knowledge. ", Curiosity       ,30.0,15.0, Twitter  ,3000.0,75.0,0.025
 ApatheticObserver ," Lost in the vast sea of information, an indifferent wave in the digital ocean. ", Indifference    ,15.0,7.0, Instagram ,3000.0,36.0,0.012
 SeekingClarity    ," The complex puzzle of life leaves me in a state of perpetual confusion, seeking answers in the chaos. ", Confusion       ,20.0,10.0, Facebook ,3000.0,50.0,0.016666666666666666
 EmotionallyDistant ," A numbness settles over me, a shield against the overwhelming emotions life throws my way. ", Numbness        ,15.0,8.0, Twitter  ,3000.0,39.0,0.013
 SunsetDreamer     ," Gazing at the sunset, a melancholic longing for moments that slip through the fingers of time. ", Melancholy      ,25.0,12.0, Instagram ,3000.0,61.0,0.02033333333333333
 MemoryLaneTraveler ," Revisiting old photographs, caught in the embrace of nostalgia's bittersweet symphony. ", Nostalgia       ,20.0,10.0, Facebook ,3000.0,50.0,0.016666666666666666
 MixedFeelings     ," Torn between conflicting emotions, an ambivalence that paints my decisions in shades of uncertainty. ", Ambivalence     ,25.0,12.0, Twitter  ,3000.0,61.0,0.02033333333333333
 ZenLifestyle      ," Embracing the ebb and flow of life, finding acceptance in the dance of existence. ", Acceptance      ,30.0,15.0, Instagram ,3000.0,75.0,0.025
 ResilientSpirit   ," Facing challenges head-on, a determination that fuels the fire within to achieve the impossible. ", Determination   ,20.0,10.0, Facebook ,3000.0,50.0,0.016666666666666666
 NatureSoul        ," Serenity found in the stillness of nature, a tranquil retreat from the chaos of the modern world. ", Serenity        ,25.0,12.0, Twitter  ,3000.0,61.0,0.02033333333333333
 EternalLearner    ," Curiosity leading me down the rabbit hole of knowledge, a perpetual student in life's classroom. ", Curiosity       ,40.0,20.0, Instagram ,3000.0,100.0,0.03333333333333333
 AloofObserver     ," Floating through the day with an air of indifference, detached from the mundane happenings around. ", Indifference    ,20.0,10.0, Facebook ,3000.0,50.0,0.016666666666666666
 ThoughtExplorer   ," Entangled in the web of thoughts, confusion reigning as I navigate the labyrinth of ideas. ", Confusion       ,30.0,15.0, Twitter  ,3000.0,75.0,0.025
 StoicSoul         ," Numb to the chaos, emotions locked away, a stoic facade concealing the inner turmoil. ", Numbness        ,15.0,8.0, Instagram ,3000.0,39.0,0.013
 DreamerInSilence  ," Melancholy whispers in the breeze, a silent conversation with the echoes of forgotten dreams. ", Melancholy      ,25.0,12.0, Facebook ,3000.0,61.0,0.02033333333333333
 JournalKeeper     ," Stumbling upon an old journal, nostalgia flooding in waves, carrying me to moments long gone. ", Nostalgia       ,20.0,10.0, Twitter  ,3000.0,50.0,0.016666666666666666
 ThreadWeaver      ," A tapestry of conflicting feelings, weaving through uncertainty, caught in the threads of ambivalence. ", Ambivalence     ,25.0,12.0, Instagram ,3000.0,61.0,0.02033333333333333
 SelfLoveAdvocate  ," Embracing the flaws, finding acceptance in imperfection, a journey towards self-love. ", Acceptance      ,30.0,15.0, Facebook ,3000.0,75.0,0.025
 DreamChaser       ," Determination burning like a wildfire, overcoming obstacles, turning dreams into reality. ", Determination   ,35.0,18.0, Twitter  ,3000.0,89.0,0.029666666666666668
 OceanSoul         ," Tranquil moments by the ocean, serenity washing over, a peaceful retreat within the waves' embrace. ", Serenity        ,50.0,25.0, Instagram ,3000.0,125.0,0.041666666666666664
 HorizonExplorer   ," Exploring new horizons with the spark of curiosity, an adventurer in the vast landscape of knowledge. ", Curiosity       ,45.0,22.0, Facebook ,3000.0,111.0,0.037
 NonchalantSpirit  ," Drifting through the day with a nonchalant demeanor, embracing the art of indifference. ", Indifference    ,18.0,9.0, Twitter  ,3000.0,45.0,0.015
 ComplexThinker    ," Wrestling with thoughts, a perplexed mind lost in the labyrinth of life's complexities. ", Confusion       ,28.0,14.0, Instagram ,3000.0,70.0,0.023333333333333334
 ShieldedHeart     ," Immersed in a state of emotional numbness, a shield against the storm of daily struggles. ", Numbness        ,20.0,10.0, Facebook ,3000.0,50.0,0.016666666666666666
 SymphonySoul      ," A melancholic symphony playing in the background, the soundtrack of a wistful heart. ", Melancholy      ,26.0,13.0, Twitter  ,3000.0,65.0,0.021666666666666667
 YearbookExplorer  ," Flipping through the pages of an old yearbook, nostalgia painting smiles and tears on my face. ", Nostalgia       ,25.0,12.0, Instagram ,3000.0,61.0,0.02033333333333333
 DecisiveDilemma   ," Torn between opposing emotions, an ambivalence that colors my decisions with shades of uncertainty. ", Ambivalence     ,30.0,15.0, Facebook ,3000.0,75.0,0.025
 ImperfectHarmony  ," Embracing life's imperfections, finding acceptance in the journey, scars and all. ", Acceptance      ,36.0,18.0, Twitter  ,3000.0,90.0,0.03
 VisionarySpirit   ," A fiery determination burning within, fueled by the vision of reaching unparalleled heights. ", Determination   ,40.0,20.0, Instagram ,3000.0,100.0,0.03333333333333333
 ForestDreamer     ," Basking in the serenity of a quiet forest, where the whispers of nature bring peace to the soul. ", Serenity        ,50.0,25.0, Facebook ,3000.0,125.0,0.041666666666666664
 SilentSpectator   ," Indifferent to the noise of the world, a silent observer in the midst of life's cacophony. ", Indifference    ,18.0,9.0, Instagram ,3000.0,45.0,0.015
 MazeNavigator     ," Navigating through the labyrinth of thoughts, confusion a constant companion in the maze of ideas. ", Confusion       ,28.0,14.0, Facebook ,3000.0,70.0,0.023333333333333334
 ResilientFortress ," An impenetrable numbness shields me from the emotional storms, a fortress of stoic resilience. ", Numbness        ,22.0,11.0, Twitter  ,3000.0,55.0,0.018333333333333333
 CanvasDreamer     ," Melancholy painting the world in hues of nostalgia, a canvas of bittersweet memories. ", Melancholy      ,26.0,13.0, Instagram ,3000.0,65.0,0.021666666666666667
 DiaryExplorer     ," A journey into the past, flipping through the pages of an old diary, nostalgia taking the lead. ", Nostalgia       ,25.0,12.0, Facebook ,3000.0,61.0,0.02033333333333333
 CrossroadsTraveler ," Ambivalence clouding decisions, caught in the crossroads of conflicting emotions. ", Ambivalence     ,30.0,15.0, Twitter  ,3000.0,75.0,0.025
 MosaicDreamer     ," Embracing imperfections, finding acceptance in the mosaic of life's beautiful chaos. ", Acceptance      ,36.0,18.0, Instagram ,3000.0,90.0,0.03
 PathfinderSpirit  ," Determination as the driving force, propelling me forward on the path to extraordinary achievements. ", Determination   ,40.0,20.0, Facebook ,3000.0,100.0,0.03333333333333333
 RaindropHarmony   ," Seeking serenity in the melody of raindrops, a tranquil escape from the noise of everyday life. ", Serenity        ,50.0,25.0, Twitter  ,3000.0,125.0,0.041666666666666664
 SeekerOfUnknowns  ," Curiosity driving the exploration of the unknown, a seeker of knowledge in uncharted territories. ", Curiosity       ,45.0,22.0, Instagram ,3000.0,111.0,0.037
 NonchalantWanderer," Drifting through the day with an air of nonchalance, indifferent to the trivialities of life. ", Indifference    ,18.0,9.0, Facebook ,3000.0,45.0,0.015
 ShadowedSeeker    ," Lost in the labyrinth of thoughts, confusion casting shadows on the quest for clarity. ", Confusion       ,28.0,14.0, Twitter  ,3000.0,70.0,0.023333333333333334
 TurbulentShield   ," Wrapped in the cloak of emotional numbness, a shield against the storms of life's turbulence. ", Numbness        ,20.0,10.0, Instagram ,3000.0,50.0,0.016666666666666666
 WistfulPainter    ," Melancholy as a companion, painting the canvas of life with the brushstrokes of wistful yearning. ", Melancholy      ,26.0,13.0, Facebook ,3000.0,65.0,0.021666666666666667
 TaleWeaver        ," Leafing through the pages of an old photo album, nostalgia weaving tales of laughter and tears. ", Nostalgia       ,25.0,12.0, Twitter  ,3000.0,61.0,0.02033333333333333
 CrossroadsExplorer," Ambivalence in the air, caught between the crossroads of conflicting emotions and decisions. ", Ambivalence     ,30.0,15.0, Instagram ,3000.0,75.0,0.025
 MosaicArtist      ," Embracing the beauty in imperfections, finding acceptance in the mosaic of life's unpredictable art. ", Acceptance      ,36.0,18.0, Facebook ,3000.0,90.0,0.03
 DreamSculptor     ," Determination ablaze, forging a path through challenges, sculpting dreams into tangible realities. ", Determination   ,40.0,20.0, Twitter  ,3000.0,100.0,0.03333333333333333
 MoonlitSoul       ," Immerse in the serenity of a moonlit night, where the quiet whispers of nature bring peace to the soul. ", Serenity        ,50.0,25.0, Instagram ,3000.0,125.0,0.041666666666666664
 FearlessExplorer  ," Fueled by curiosity, venturing into uncharted realms, a fearless explorer of the mysteries of the world. ", Curiosity       ,44.0,22.0, Facebook ,3000.0,110.0,0.03666666666666667
 TurbulentShield ,"Wrapped in the cloak of emotional numbness, a shield against the storms of life's turbulence. ", Numbness ,20.0,10.0, Instagram ,3000.0,50.0,0.016666666666666666
 JoyfulDancer ," Dancing through life with the exuberance of a carefree spirit, embracing joy and zest at every turn. ", Zest ,30.0,15.0, Twitter ,3000.0,75.0,0.025
 SereneBasker ," Basking in the golden glow of contentment, a serene river flowing through the landscape of the heart. ", Contentment ,36.0,18.0, Facebook ,3000.0,90.0,0.03
 DreamPainter ," Gazing towards the horizon with hopeful eyes, painting a canvas of dreams illuminated by the sun of optimism. ", Hopeful ,24.0,12.0, Instagram ,3000.0,60.0,0.02
 OakAchiever ," Standing tall, proud as an oak, the branches of achievement reaching towards the sky of accomplishment. ", Proud ,50.0,25.0, Twitter ,3000.0,125.0,0.041666666666666664
 HeartGardener ," A heart overflowing with gratitude, a garden where appreciation blooms in the soil of kindness and connection. ", Grateful ,40.0,20.0, Facebook ,3000.0,100.0,0.03333333333333333
 ThreadWeaver ," Extending a hand, empathetic threads weaving a tapestry of understanding, embracing the joys and sorrows of others. ", Empathetic ,30.0,15.0, Instagram ,3000.0,75.0,0.025
 CloudCaretaker ," Compassionate clouds, heavy with care, showering empathy on the parched grounds of human suffering. ", Compassionate ,36.0,18.0, Twitter ,3000.0,90.0,0.03
 RainDancer ," Playfully dancing in the rain of laughter, a whimsical spirit twirling in the puddles of joy and lightheartedness. ", Playful ,44.0,22.0, Facebook ,3000.0,110.0,0.03666666666666667
 SkyPainter ," Soaring on the wings of a free spirit, unburdened by the chains of conformity, painting the sky with independence. ", Free-spirited ,40.0,20.0, Instagram ,3000.0,100.0,0.03333333333333333
 PhoenixExplorer ," Bathed in the glow of inspiration, a creative phoenix rising from the ashes of ordinary thoughts to explore new realms. ", Inspired ,30.0,15.0, Twitter ,3000.0,75.0,0.025
 SunriseNavigator ," Navigating the sea of hope, sailing towards the sunrise of possibilities, confident in the ship of positive anticipation. ", Hopeful ,24.0,12.0, Facebook ,3000.0,60.0,0.02
 SandStrider ," Striding with confidence, footprints of self-assuredness imprinted on the sands of challenges conquered and victories claimed. ", Confident ,50.0,25.0, Instagram ,3000.0,125.0,0.041666666666666664
 NightSerenader ," Lost in the symphony of the night, a moonlit serenade that whispers tales of wanderlust and moonlit dreams. ", Serenity ,26.0,13.0, Twitter ,3000.0,65.0,0.021666666666666667
 KnowledgeSeeker ," Unveiling the layers of curiosity, a labyrinth of questions leading to the treasure troves of undiscovered knowledge. ", Curiosity ,34.0,17.0, Instagram ,3000.0,85.0,0.028333333333333332
 BreezeWaltzer ," In the embrace of the autumn breeze, leaves of ambivalence dancing in a waltz between choices and uncertainties. ", Ambivalence ,28.0,14.0, Facebook ,3000.0,70.0,0.023333333333333334
 StarNavigator ," Gratitude as a guiding star, navigating the constellation of blessings in the vast universe of life's precious moments. ", Grateful ,38.0,19.0, Twitter ,3000.0,95.0,0.03166666666666667
 MeadowSprinter ," With a zestful heart, sprinting through fields of enthusiasm, chasing sunbeams and laughter in the meadows of joy. ", Zest ,32.0,16.0, Instagram ,3000.0,80.0,0.02666666666666667
 RainNurturer ," A compassionate rain, tears of empathy falling gently, nurturing the seeds of kindness in the garden of human connections. ", Compassionate ,42.0,21.0, Facebook ,3000.0,105.0,0.035
 PeakConqueror ," Proudly scaling the peaks of achievement, a mountaineer conquering challenges and planting the flag of success. ", Proud ,46.0,23.0, Twitter ,3000.0,115.0,0.03833333333333333
 DawnGardener ," Embraced by the hopeful dawn, a gardener sowing seeds of optimism, tending to the blooms of a brighter tomorrow. ", Hopeful ,28.0,14.0, Instagram ,3000.0,70.0,0.023333333333333334
 CarnivalDreamer ," A playful escapade in the carnival of life, carousel laughter and cotton candy dreams swirling in the joyous atmosphere. ", Playful ,48.0,24.0, Facebook ,3000.0,120.0,0.04
 SkyArtist ," Floating on clouds of inspiration, an artist painting the sky with strokes of creativity, creating a masterpiece of dreams. ", Inspired ,36.0,18.0, Twitter ,3000.0,90.0,0.03
 RiverNavigator ," Navigating the river of contentment, a serene boat cruise through the tranquil waters of inner peace and acceptance. ", Contentment ,40.0,20.0, Instagram ,3000.0,100.0,0.03333333333333333
 LanternWanderer ," With empathy as a lantern, wandering through the dark alleys of sorrow, illuminating the path with compassion and care. ", Empathetic ,32.0,16.0, Facebook ,3000.0,80.0,0.02666666666666667
 DreamSoarer ," A free spirit soaring on the wings of dreams, leaving trails of independence in the azure sky of boundless possibilities. ", Free-spirited ,44.0,22.0, Twitter ,3000.0,110.0,0.03666666666666667
 SunsetAdmirer ," Bathed in the golden hues of gratefulness, a sunset of appreciation casting its warm glow on the landscapes of the heart. ", Grateful ,38.0,19.0, Instagram ,3000.0,95.0,0.03166666666666667
 DanceStrider ," Confident strides in the dance of life, a ballroom where self-assuredness leads, twirling through challenges with grace. ", Confident ,46.0,23.0, Facebook ,3000.0,115.0,0.03833333333333333
 WindWhisperer ," Hopeful whispers of wind, carrying the promises of a brighter tomorrow, a symphony of optimism in the air of possibilities. ", Hopeful ,30.0,15.0, Twitter ,3000.0,75.0,0.025
 JugglingArtist ," Playfully juggling responsibilities, a circus performer balancing the acts of work and joy, tossing laughter into the air. ", Playful ,50.0,25.0, Instagram ,3000.0,125.0,0.041666666666666664
 StarStoryteller ," Whispering tales of inspiration to the stars, a storyteller crafting constellations from the threads of imagination. ", Inspired ,28.0,14.0, Facebook ,3000.0,70.0,0.023333333333333334
 WaveNavigator ," Charting a course through the waves of hopeful anticipation, a sailor steering towards the shores of dreams yet unexplored. ", Hopeful ,34.0,17.0, Twitter ,3000.0,85.0,0.028333333333333332
 RainNurturer ," A compassionate rain, tears of empathy falling gently, nurturing the seeds of kindness in the garden of human connections. ", Compassionate ,42.0,21.0, Instagram ,3000.0,105.0,0.035
 PeakConqueror ," Proudly scaling the peaks of achievement, a mountaineer conquering challenges and planting the flag of success. ", Proud ,46.0,23.0, Twitter ,3000.0,115.0,0.03833333333333333
 DawnGardener ," Embraced by the hopeful dawn, a gardener sowing seeds of optimism, tending to the blooms of a brighter tomorrow. ", Hopeful ,28.0,14.0, Instagram ,3000.0,70.0,0.023333333333333334
 CarnivalDreamer ," A playful escapade in the carnival of life, carousel laughter and cotton candy dreams swirling in the joyous atmosphere. ", Playful ,48.0,24.0, Facebook ,3000.0,120.0,0.04
 SkyArtist ," Floating on clouds of inspiration, an artist painting the sky with strokes of creativity, creating a masterpiece of dreams. ", Inspired ,36.0,18.0, Twitter ,3000.0,90.0,0.03
 RiverNavigator ," Navigating the river of contentment, a serene boat cruise through the tranquil waters of inner peace and acceptance. ", Contentment ,40.0,20.0, Instagram ,3000.0,100.0,0.03333333333333333
 LanternWanderer ," With empathy as a lantern, wandering through the dark alleys of sorrow, illuminating the path with compassion and care. ", Empathetic ,32.0,16.0, Facebook ,3000.0,80.0,0.02666666666666667
 DreamSoarer ," A free spirit soaring on the wings of dreams, leaving trails of independence in the azure sky of boundless possibilities. ", Free-spirited ,44.0,22.0, Twitter ,3000.0,110.0,0.03666666666666667
 SunsetAdmirer ," Bathed in the golden hues of gratefulness, a sunset of appreciation casting its warm glow on the landscapes of the heart. ", Grateful ,38.0,19.0, Instagram ,3000.0,95.0,0.03166666666666667
 DanceStrider ," Confident strides in the dance of life, a ballroom where self-assuredness leads, twirling through challenges with grace. ", Confident ,46.0,23.0, Facebook ,3000.0,115.0,0.03833333333333333
 WindWhisperer ," Hopeful whispers of wind, carrying the promises of a brighter tomorrow, a symphony of optimism in the air of possibilities. ", Hopeful ,30.0,15.0, Twitter ,3000.0,75.0,0.025
 JugglingArtist ," Playfully juggling responsibilities, a circus performer balancing the acts of work and joy, tossing laughter into the air. ", Playful ,50.0,25.0, Instagram ,3000.0,125.0,0.041666666666666664
 StarStoryteller ," Whispering tales of inspiration to the stars, a storyteller crafting constellations from the threads of imagination. ", Inspired ,28.0,14.0, Facebook ,3000.0,70.0,0.023333333333333334
 WaveNavigator ," Charting a course through the waves of hopeful anticipation, a sailor steering towards the shores of dreams yet unexplored. ", Hopeful ,34.0,17.0, Twitter ,3000.0,85.0,0.028333333333333332
 RainNurturer ," A compassionate rain, tears of empathy falling gently, nurturing the seeds of kindness in the garden of human connections. ", Compassionate ,42.0,21.0, Instagram ,3000.0,105.0,0.035
 PeakConqueror ," Proudly scaling the peaks of achievement, a mountaineer conquering challenges and planting the flag of success. ", Proud ,46.0,23.0, Twitter ,3000.0,115.0,0.03833333333333333
 DawnGardener ," Embraced by the hopeful dawn, a gardener sowing seeds of optimism, tending to the blooms of a brighter tomorrow. ", Hopeful ,28.0,14.0, Instagram ,3000.0,70.0,0.023333333333333334
 CarnivalDreamer ," A playful escapade in the carnival of life, carousel laughter and cotton candy dreams swirling in the joyous atmosphere. ", Playful ,48.0,24.0, Facebook ,3000.0,120.0,0.04
 ShatteredHeart ," Drowning in the abyss of despair, a heart shattered into fragments, lost in the echoing silence of hopelessness. ", Despair ,16.0,8.0, Instagram ,3000.0,40.0,0.013333333333333334
 VenomousSoul ," Bitterness festering like a venomous vine, entwining the soul in a web of resentment, poisoning the garden of peace. ", Bitterness ,24.0,12.0, Facebook ,3000.0,60.0,0.02
 DesertWanderer ," Wandering through the desert of loneliness, each step a heavy sigh, mirages of connection shimmering but never materializing. ", Loneliness ,30.0,15.0, Twitter ,3000.0,75.0,0.025
 ColdEmbrace ," Yearning for a touch that's not there, echoes of a distant warmth haunting the heart in the cold embrace of solitude. ", Yearning ,20.0,10.0, Instagram ,3000.0,50.0,0.016666666666666666
 NightPrisoner ," Eyes wide open in the night, fearful shadows dancing on the walls, the mind a prisoner of imagined horrors. ", Fearful ,36.0,18.0, Facebook ,3000.0,90.0,0.03
 TightropeWalker ," Apprehensive steps on the tightrope of uncertainty, a balancing act where the fall seems inevitable, anxiety a constant companion. ", Apprehensive ,28.0,14.0, Twitter ,3000.0,70.0,0.023333333333333334
 AtlasBearer ," Overwhelmed by the weight of the world, Atlas with trembling shoulders, each responsibility a boulder in the landscape of exhaustion. ", Overwhelmed ,44.0,22.0, Instagram ,3000.0,110.0,0.03666666666666667
 GreenMonster ," Jealousy, a green-eyed monster, lurking in the shadows, casting a dark cloud over the sunshine of others' success. ", Jealous ,32.0,16.0, Facebook ,3000.0,80.0,0.02666666666666667
 StormSurvivor ," Devastated by the storm of betrayal, the wreckage of trust scattered like debris, a heart torn by the winds of broken promises. ", Devastated ,50.0,25.0, Twitter ,3000.0,125.0,0.041666666666666664
 PuzzleComposer ," Frustrated fingers tapping on the keyboard, a symphony of annoyance composing an unsolvable puzzle of unmet expectations. ", Frustrated ,24.0,12.0, Instagram ,3000.0,60.0,0.02
 GildedHeartache ," Envious eyes fixated on the gilded prize, a heartache fueled by the painful desire for possessions that seem forever out of reach. ", Envious ,40.0,20.0, Facebook ,3000.0,100.0,0.03333333333333333
 IndifferentFort ," Dismissive glances, a fortress built with indifference, walls impenetrable to the pleas of understanding and recognition. ", Dismissive ,28.0,14.0, Twitter ,3000.0,70.0,0.023333333333333334
 DreamMosaic ," Shattered dreams lie on the floor like fragments of glass, a mosaic of disappointment crafted by the hands of frustration. ", Frustrated ,30.0,15.0, Instagram ,3000.0,75.0,0.025
 NocturnalEcho ," Loneliness, a silent companion in the night, the only echo in the chamber of solitude, a heart's solitary nocturne. ", Loneliness ,36.0,18.0, Facebook ,3000.0,90.0,0.03
 DarkWhispers ," Fearful whispers in the dark, the mind haunted by the specter of the unknown, shadows dancing to the rhythm of anxiety's tune. ", Fearful ,26.0,13.0, Twitter ,3000.0,65.0,0.021666666666666667
 LingeringTaste ," Bitterness, a bitter aftertaste lingering on the tongue, each word a reminder of wounds that refuse to heal with the passing of time. ", Bitterness ,20.0,10.0, Instagram ,3000.0,50.0,0.016666666666666666
 TempestSurvivor ," Overwhelmed by the cacophony of expectations, a drowning soul in the tempest of pressure, struggling to stay afloat. ", Overwhelmed ,40.0,20.0, Facebook ,3000.0,100.0,0.03333333333333333
 VenomousHeart ," Jealousy, a venom that seeps through the veins, poisoning the heart and turning it into a breeding ground for discontent. ", Jealous ,32.0,16.0, Twitter ,3000.0,80.0,0.02666666666666667
 FragileTrust ," Devastated by the revelation of betrayal, the trust shattered like fragile glass, leaving shards of pain in its wake. ", Devastated ,50.0,25.0, Instagram ,3000.0,125.0,0.041666666666666664
 BrokenThreads ," Frustrated attempts to mend a broken connection, the threads of understanding slipping through the fingers like grains of sand. ", Frustrated ,28.0,14.0, Facebook ,3000.0,70.0,0.023333333333333334
 SuccessPill ," Envious gazes cast upon the podium of success, a bitter pill swallowed, the taste lingering as a constant reminder of unattained heights. ", Envious ,40.0,20.0, Twitter ,3000.0,100.0,0.03333333333333333
 CurtainShield ," Dismissive gestures, a curtain drawn to shield the vulnerability, a stage where emotions take a backseat to the performance of indifference. ", Dismissive ,24.0,12.0, Instagram ,3000.0,60.0,0.02
 FoggyLabyrinth ," Despair like a heavy fog, enveloping every thought, blurring the path ahead, a journey in the labyrinth of utter hopelessness. ", Despair ,16.0,8.0, Facebook ,3000.0,40.0,0.013333333333333334
 IcyResentment ," Bitterness, a bitter chill in the air, freezing moments into icicles of resentment that dangle precariously over the landscape of memory. ", Bitterness ,30.0,15.0, Twitter ,3000.0,75.0,0.025
 SolitaryMoon ," Loneliness, a solitary moon in a starless sky, casting a cold glow on the landscape of isolation, where echoes bounce in empty spaces. ", Loneliness ,36.0,18.0, Instagram ,3000.0,90.0,0.03
 VanishedSunset ," Yearning for the warmth of a vanished sun, a heartache painted in the hues of a sunset that never graced the horizon. ", Yearning ,20.0,10.0, Facebook ,3000.0,50.0,0.016666666666666666
 NightPrisoner ," Fearful eyes scanning the shadows, a prisoner of the night, terrorized by the lurking monsters born from the mind's darkest corners. ", Fearful ,36.0,18.0, Twitter ,3000.0,90.0,0.03
 WindWhisperer ," Apprehensive whispers in the wind, a forecast of uncertainty, the mind's weather vane spinning wildly in the storm of doubt. ", Apprehensive ,28.0,14.0, Instagram ,3000.0,70.0,0.023333333333333334
 MazeExplorer ," Overwhelmed by the maze of expectations, a minotaur of pressure lurking in the labyrinth, waiting to devour the spirit of resilience. ", Overwhelmed ,44.0,22.0, Facebook ,3000.0,110.0,0.03666666666666667
