influencer,comment,sentiment,likes,shares,platform,cost,engagement,roi
 WoundedGarden ," Jealousy, a festering wound, the pain intensifying with each glance at the garden of others' achievements, blooming beyond the fence. ", Jealous ,32.0,16.0, Twitter ,3000.0,80.0,0.02666666666666667
 RuinedHeart ," Devastated, a heart in ruins, the echoes of shattered dreams reverberating in the chambers, a requiem for what once was whole. ", Devastated ,50.0,25.0, Instagram ,3000.0,125.0,0.041666666666666664
 KnotUntangler ," Frustrated attempts to untangle the knot of confusion, the threads of understanding slipping further into the labyrinth of miscommunication. ", Frustrated ,28.0,14.0, Facebook ,3000.0,70.0,0.023333333333333334
 ElusiveKeys ," Envious eyes locked on the treasure chest of opportunities, a heartache fueled by the desire for keys that seem forever elusive. ", Envious ,40.0,20.0, Twitter ,3000.0,100.0,0.03333333333333333
 IndifferentFort ," Dismissive gestures, a curtain drawn to shield the vulnerability, a stage where emotions take a backseat to the performance of indifference. ", Dismissive ,24.0,12.0, Instagram ,3000.0,60.0,0.02
 DreamMosaic ," Shattered dreams lie on the floor like fragments of glass, a mosaic of disappointment crafted by the hands of frustration. ", Frustrated ,30.0,15.0, Twitter ,3000.0,75.0,0.025
 NocturnalEcho ," Loneliness, a silent companion in the night, the only echo in the chamber of solitude, a heart's solitary nocturne. ", Loneliness ,36.0,18.0, Facebook ,3000.0,90.0,0.03
 NatureAdmirer  ,Awe-struck by the breathtaking sunrise over the mountains.      , Awe           ,55.0,28.0, Instagram ,3000.0,139.0,0.04633333333333333
 GoalPursuer    ,Navigating through the challenges with determination.          , Determination ,30.0,15.0, Twitter  ,3000.0,75.0,0.025
 MemoryLane     ,Nostalgia hits while flipping through an old photo album.     , Nostalgia      ,45.0,22.0, Facebook ,3000.0,111.0,0.037
 CultureEnthusiast ,Thrilled to witness the grandeur of a cultural festival.       , Thrill        ,80.0,40.0, Instagram ,3000.0,200.0,0.06666666666666667
 RainWatcher    ,Calmness found in the rhythm of raindrops on the windowpane.   , Calmness      ,35.0,18.0, Twitter  ,3000.0,89.0,0.029666666666666668
 PersonalJourney ,Overwhelmed by the support received during a personal challenge., Overwhelmed   ,50.0,25.0, Facebook ,3000.0,125.0,0.041666666666666664
 VacationDreamer ,Excitement builds as the countdown to a long-awaited vacation begins. , Excitement ,60.0,30.0, Instagram ,3000.0,150.0,0.05
 LifeLearner   ,"Reflecting on life's journey, grateful for the lessons learned. ", Gratitude   ,70.0,35.0, Twitter  ,3000.0,175.0,0.058333333333333334
 FarewellSender ,Bittersweet emotions arise while bidding farewell to a dear friend. , Bittersweet ,40.0,20.0, Instagram ,3000.0,100.0,0.03333333333333333
 HistoryExplorer ,Curiosity sparked by exploring a mysterious ancient ruin.      , Curiosity     ,35.0,18.0, Facebook ,3000.0,89.0,0.029666666666666668
 CraftEnthusiast ,Admiration for the intricate details of a handcrafted masterpiece. , Admiration    ,50.0,25.0, Instagram ,3000.0,125.0,0.041666666666666664
 WinterLover     ,Overjoyed by the warmth of a cozy fireplace on a winter evening.   , Overjoyed     ,35.0,18.0, Twitter  ,3000.0,89.0,0.029666666666666668
 SunsetWatcher   ,Inspiration strikes while observing the colors of a vibrant sunset., Inspiration   ,60.0,30.0, Instagram ,3000.0,150.0,0.05
 FitnessJunkie   ,Motivated to achieve fitness goals after an invigorating workout.  , Motivation    ,80.0,40.0, Facebook ,3000.0,200.0,0.06666666666666667
 CoffeeLover     ,Gratitude for the simple joys found in a cup of morning coffee.    , Gratitude     ,45.0,22.0, Twitter  ,3000.0,111.0,0.037
 HikingExplorer  ,Feeling empowered after conquering a challenging hiking trail.     , Empowerment   ,70.0,35.0, Instagram ,3000.0,175.0,0.058333333333333334
 KittyObserver   ,Amused by the antics of playful kittens during playtime.           , Amusement     ,30.0,15.0, Facebook ,3000.0,75.0,0.025
 Stargazer       ,Contemplating life's mysteries under the starry night sky.         , Contemplation ,55.0,28.0, Twitter  ,3000.0,139.0,0.04633333333333333
 FriendshipRenewal ,Joyful reunion with long-lost friends after years of separation.   , JoyfulReunion ,40.0,20.0, Instagram ,3000.0,100.0,0.03333333333333333
 CelebrationPlanner ,Excitement builds while preparing for a surprise celebration.     , Excitement    ,60.0,30.0, Facebook ,3000.0,150.0,0.05
 DIYEnthusiast   ,Satisfaction derived from successfully completing a DIY project.  , Satisfaction  ,50.0,25.0, Twitter  ,3000.0,125.0,0.041666666666666664
 CommunityHelper ,Feeling blessed for the supportive community in times of need.    , Blessed       ,35.0,18.0, Instagram ,3000.0,89.0,0.029666666666666668
 GardenEnthusiast ,Captivated by the serenity of a tranquil garden in full bloom.     , Serenity      ,45.0,22.0, Facebook ,3000.0,111.0,0.037
 Wanderlust      ,Anticipation for an upcoming adventure in an exotic destination.   , Anticipation  ,80.0,40.0, Twitter  ,3000.0,200.0,0.06666666666666667
 GrowthSeeker    ,Reflecting on personal growth achieved through life experiences.  , Reflection    ,70.0,35.0, Instagram ,3000.0,175.0,0.058333333333333334
 ChildhoodMemories ,Nostalgic memories flood in while revisiting childhood favorites. , Nostalgia     ,40.0,20.0, Facebook ,3000.0,100.0,0.03333333333333333
 CultureExplorer ,Appreciation for the vibrant culture experienced during travel.   , Appreciation  ,55.0,28.0, Twitter  ,3000.0,139.0,0.04633333333333333
 PublicSpeaker   ,Confidence soars after overcoming public speaking anxiety.       , Confidence    ,30.0,15.0, Instagram ,3000.0,75.0,0.025
 FamilyCelebration ,Contentment in the midst of a family gathering filled with laughter. , Contentment   ,50.0,25.0, Facebook ,3000.0,125.0,0.041666666666666664
 LifelongLearner ,Enthusiasm for learning new skills and expanding knowledge.      , Enthusiasm    ,60.0,30.0, Twitter  ,3000.0,150.0,0.05
 CityExplorer    ,Surprise and delight at discovering a hidden gem in the city.    , Surprise      ,35.0,18.0, Instagram ,3000.0,89.0,0.029666666666666668
 FitnessAchiever ,A sense of accomplishment after completing a challenging workout., Accomplishment ,45.0,22.0, Facebook ,3000.0,111.0,0.037
 RainbowChaser   ,Wonderment at the beauty of a double rainbow after the rain.     , Wonderment    ,70.0,35.0, Twitter  ,3000.0,175.0,0.058333333333333334
 FutureOptimist  ,Optimism for a bright future amidst challenging times.           , Optimism      ,40.0,20.0, Instagram ,3000.0,100.0,0.03333333333333333
 CareerAchiever  ,Pride in achieving a personal milestone in career progression.   , Pride         ,55.0,28.0, Facebook ,3000.0,139.0,0.04633333333333333
 SunnyDayEnthusiast ,Happiness blooms like flowers in a garden on a sunny day.        , Happiness     ,30.0,15.0, Twitter  ,3000.0,75.0,0.025
 Bookworm        ,Elation over discovering a rare book in a quaint bookstore.      , Elation       ,80.0,40.0, Instagram ,3000.0,200.0,0.06666666666666667
 ArchaeologyEnthusiast ,Curiosity piqued by the mysteries of an ancient archaeological site., Curiosity   ,35.0,18.0, Facebook ,3000.0,89.0,0.029666666666666668
 NightSkyObserver ,Mesmerized by the cosmic dance of fireflies on a moonlit night.    , Enchantment   ,50.0,25.0, Instagram ,3000.0,125.0,0.041666666666666664
 ArtConnoisseur  ,Intrigued by the symphony of colors in an abstract art exhibition. , Intrigue      ,35.0,18.0, Twitter  ,3000.0,89.0,0.029666666666666668
 PlayfulParent   ,Giggles and joy echo in the air during a children's playdate.      , PlayfulJoy    ,45.0,22.0, Facebook ,3000.0,111.0,0.037
 ZenSeeker       ,Enveloped in serenity while practicing mindfulness by the lake.    , Mindfulness   ,70.0,35.0, Instagram ,3000.0,175.0,0.058333333333333334
 SkyDreamer      ,Chasing dreams like a kite soaring high in the vast open sky.      , DreamChaser   ,60.0,30.0, Twitter  ,3000.0,150.0,0.05
 DanceEnthusiast ,Spellbound by the elegance of a ballroom dance under crystal chandeliers. , Elegance ,55.0,28.0, Facebook ,3000.0,139.0,0.04633333333333333
 FairyTaleExplorer ,Whimsical delight in a world of fairy tales and magical creatures.  , Whimsy        ,40.0,20.0, Instagram ,3000.0,100.0,0.03333333333333333
 RuinsExplorer   ,Pensive contemplation amid the ancient ruins of a forgotten civilization. , Pensive ,35.0,18.0, Twitter  ,3000.0,89.0,0.029666666666666668
 RollercoasterFan ,Embracing the thrill of speed on a rollercoaster's exhilarating twists. , Thrill      ,45.0,22.0, Facebook ,3000.0,111.0,0.037
 MusicHarmonist  ,Harmony resonates as musicians play a melody of unity and togetherness. , Harmony    ,70.0,35.0, Instagram ,3000.0,175.0,0.058333333333333334
 StudioArtist    ,A burst of creativity in the quiet solitude of an artist's studio.  , Creativity   ,30.0,15.0, Twitter  ,3000.0,75.0,0.025
 SpringEnthusiast ,Radiant joy akin to blooming flowers on a sun-kissed spring morning. , Radiance    ,50.0,25.0, Facebook ,3000.0,125.0,0.041666666666666664
 CosmosExplorer  ,A sense of wonder at the vastness of the cosmos on a stargazing night. , Wonder     ,80.0,40.0, Instagram ,3000.0,200.0,0.06666666666666667
 SeaBreezeLover ,Rejuvenated by the salty breeze and the sound of waves at the seaside. , Rejuvenation ,35.0,18.0, Twitter  ,3000.0,89.0,0.029666666666666668
 ForestDreamer   ,Whispers of inspiration from the rustling leaves in a serene forest. , Inspiration ,55.0,28.0, Facebook ,3000.0,139.0,0.04633333333333333
 WinterWarmth    ,Savoring the warmth of a cup of cocoa on a chilly winter evening.   , Coziness     ,60.0,30.0, Instagram ,3000.0,150.0,0.05
 FamilyGatherer ,Heartfelt gratitude for the laughter shared during a family reunion. , Gratitude  ,45.0,22.0, Facebook ,3000.0,111.0,0.037
 CulinaryExplorer ,"Embarking on a culinary adventure, savoring exotic flavors around the world. ", Adventure ,70.0,35.0, Twitter  ,3000.0,175.0,0.058333333333333334
 PuzzleSolver    ,Euphoria floods in as the final puzzle piece clicks into place.       , Euphoria   ,40.0,20.0, Instagram ,3000.0,100.0,0.03333333333333333
 CathedralVisitor ,Awe-inspired by the grandeur of an ancient cathedral's intricate architecture. , Awe    ,35.0,18.0, Facebook ,3000.0,89.0,0.029666666666666668
 NightSkyObserver ,Captivated by the ethereal beauty of a field filled with fireflies. , Enchantment   ,50.0,25.0, Instagram ,3000.0,125.0,0.041666666666666664
 MusicLover      ,Immersed in the enchanting melodies of a street musician's violin. , Melodic       ,35.0,18.0, Twitter  ,3000.0,89.0,0.029666666666666668
 CarnivalGoer    ,Joyful laughter resonates through a lively summer carnival.         , FestiveJoy    ,45.0,22.0, Facebook ,3000.0,111.0,0.037
 MindfulExplorer ,Exploring the universe within during a mindful meditation session. , InnerJourney  ,70.0,35.0, Instagram ,3000.0,175.0,0.058333333333333334
 CoastalExplorer ,Soaring like a free spirit on the winds of a coastal cliff.        , Freedom       ,60.0,30.0, Twitter  ,3000.0,150.0,0.05
 MasqueradeAttendee ,Dazzled by the elegance of a masquerade ball's dazzling costumes. , Dazzle        ,55.0,28.0, Facebook ,3000.0,139.0,0.04633333333333333
 FairyTaleAdventurer ,Whimsical delight in a world of whimsical fairy tales.             , Whimsy        ,40.0,20.0, Instagram ,3000.0,100.0,0.03333333333333333
 RuinsExplorer   ,Reflective contemplation amid the ruins of a forgotten era.        , Reflection    ,35.0,18.0, Twitter  ,3000.0,89.0,0.029666666666666668
 ThrillSeeker    ,Riding the adrenaline rush on a rollercoaster's wild twists.      , Adrenaline     ,45.0,22.0, Facebook ,3000.0,111.0,0.037
 MusicHarmonist  ,Harmony resonates as musicians play a symphony of unity.           , Harmony       ,70.0,35.0, Instagram ,3000.0,175.0,0.058333333333333334
 StudioArtist    ,A burst of artistic creativity in the quietude of an artist's studio. , ArtisticBurst ,30.0,15.0, Twitter  ,3000.0,75.0,0.025
 SpringEnthusiast ,Radiant joy akin to blossoming flowers on a sunlit spring morning. , Radiance      ,50.0,25.0, Facebook ,3000.0,125.0,0.041666666666666664
 CosmosExplorer  ,Awe-inspired by the vastness of the cosmos on a stargazing night.   , Wonder       ,80.0,40.0, Instagram ,3000.0,200.0,0.06666666666666667
 SeaBreezeLover ,Rejuvenated by the salty breeze and the sound of waves at the seaside. , Rejuvenation ,35.0,18.0, Twitter  ,3000.0,89.0,0.029666666666666668
 ForestDreamer   ,Whispers of inspiration from the rustling leaves in a serene forest. , Inspiration  ,55.0,28.0, Facebook ,3000.0,139.0,0.04633333333333333
 WinterWarmth    ,Savoring the warmth of a cup of cocoa on a chilly winter evening.   , Coziness     ,60.0,30.0, Instagram ,3000.0,150.0,0.05
 FamilyGatherer ,Heartfelt gratitude for the laughter shared during a family reunion. , Gratitude  ,45.0,22.0, Facebook ,3000.0,111.0,0.037
 CulinaryExplorer ,"Embarking on a culinary odyssey, savoring flavors around the world. ", CulinaryOdyssey ,70.0,35.0, Twitter  ,3000.0,175.0,0.058333333333333334
 PuzzleSolver    ,Euphoria floods in as the final puzzle piece fits perfectly.       , Euphoria     ,40.0,20.0, Instagram ,3000.0,100.0,0.03333333333333333
 CathedralVisitor ,Awe-struck by the grandeur of an ancient cathedral's intricate architecture. , Awe    ,35.0,18.0, Facebook ,3000.0,89.0,0.029666666666666668
 ArchaeologyEnthusiast ,Curiosity awakened by the mysteries of an ancient archaeological site. , Curiosity  ,35.0,18.0, Instagram ,3000.0,89.0,0.029666666666666668
 SnowfallEnthusiast ,Giddy with excitement as the first snowflakes dance from the sky. , Excitement   ,45.0,22.0, Twitter  ,3000.0,111.0,0.037
 BreadLover     ,Contentment envelops as the aroma of freshly baked bread fills the air. , Contentment ,55.0,28.0, Instagram ,3000.0,139.0,0.04633333333333333
 NatureResilient ,Inspired by the resilience of a lone tree standing tall in a storm. , Resilience   ,70.0,35.0, Facebook ,3000.0,175.0,0.058333333333333334
 Bookworm       ,"Lost in the pages of a captivating novel, transported to another world. ", Immersion ,40.0,20.0, Twitter  ,3000.0,100.0,0.03333333333333333
 FamilyHistorian ,Drenched in nostalgia while flipping through an old family photo album. , Nostalgia ,50.0,25.0, Instagram ,3000.0,125.0,0.041666666666666664
 NightSkyWatcher ,Spark of inspiration ignites like a shooting star in the night sky. , Spark        ,60.0,30.0, Facebook ,3000.0,150.0,0.05
 TeaEnthusiast  ,Imbued with gratitude for the simple pleasure of a warm cup of tea. , Gratitude    ,35.0,18.0, Twitter  ,3000.0,89.0,0.029666666666666668
 MarketExplorer ,Marveling at the kaleidoscope of colors in a vibrant street market. , Marvel       ,45.0,22.0, Instagram ,3000.0,111.0,0.037
 LakesideRetreater ,Awash with serenity as the sun sets over a tranquil lakeside retreat. , Serenity   ,55.0,28.0, Facebook ,3000.0,139.0,0.04633333333333333
 LostInLove      ,Drowning in sorrow as memories of lost love resurface.            , Heartbreak    ,30.0,15.0, Instagram ,3000.0,75.0,0.025
 SolitudeSeeker ,Numbness sets in as the weight of loneliness grows heavier.       , Loneliness    ,35.0,18.0, Twitter  ,3000.0,89.0,0.029666666666666668
 FriendshipsEnd  ,"Tears fall like raindrops, mourning the end of a cherished friendship. ", Grief      ,45.0,22.0, Facebook ,3000.0,111.0,0.037
 LostInDarkness  ,"Despair clouds the mind, feeling adrift in an endless sea of darkness. ", Despair   ,55.0,28.0, Instagram ,3000.0,139.0,0.04633333333333333
 BrokenTrust     ,"Shattered by betrayal, trust crumbles like fragile glass.          ", Betrayal      ,45.0,22.0, Twitter  ,3000.0,111.0,0.037
 SilentSufferer  ,"Aching heart, the symphony of pain plays in the silence of solitude. ", Suffering ,50.0,25.0, Facebook ,3000.0,125.0,0.041666666666666664
 StormyFeelings  ,"Emotional storm, a whirlwind of sadness engulfs every thought.    ", EmotionalStorm ,60.0,30.0, Instagram ,3000.0,150.0,0.05
 LingeringGhost  ,"Haunted by regrets, the ghost of the past lingers relentlessly.   ", Regret        ,35.0,18.0, Twitter  ,3000.0,89.0,0.029666666666666668
 EchoesOfLoss    ,"Torn apart by grief, the echoes of loss reverberate through the soul. ", Grief      ,55.0,28.0, Facebook ,3000.0,139.0,0.04633333333333333
 WinterOfEmotions ,"Isolation deepens, an emotional winter where warmth is but a distant memory. ", Isolation ,70.0,35.0, Instagram ,3000.0,175.0,0.058333333333333334
 ShatteredHopes  ,"Soul-crushing disappointment, hopes shattered like fragile glass. ", Disappointment ,40.0,20.0, Twitter  ,3000.0,100.0,0.03333333333333333
 AbyssOfTime     ,"Painful echoes of a love once cherished, now lost in the abyss of time. ", LostLove ,45.0,22.0, Facebook ,3000.0,111.0,0.037
 SolitaryDescent ,"Heartache deepens, a solitary journey through the abyss of despair. ", Despair   ,80.0,40.0, Instagram ,3000.0,200.0,0.06666666666666667
 SerenadeOfSolitude ,"Melancholy lingers, a bittersweet serenade in the quietude of solitude. ", Melancholy ,35.0,18.0, Twitter ,3000.0,89.0,0.029666666666666668
 PoisonedHeart   ,"Bitterness like a poison, seeping into every crevice of the wounded heart. ", Bitterness ,50.0,25.0, Facebook ,3000.0,125.0,0.041666666666666664
 WearySoulCrushed ,"Emotional exhaustion, the weight of the world crushing weary shoulders. ", Exhaustion ,70.0,35.0, Instagram ,3000.0,175.0,0.058333333333333334
 StringsOfSorrow ,"Sorrowful echoes, a symphony of pain played by the strings of loss. ", Sorrow      ,35.0,18.0, Twitter  ,3000.0,89.0,0.029666666666666668
 SoulInShadow    ,"Darkness descends, engulfing the soul in the shadows of despair.  ", Darkness     ,55.0,28.0, Facebook ,3000.0,139.0,0.04633333333333333
 WhisperedDespair ,"Desperation whispers, the silent plea for a glimmer of hope in the abyss. ", Desperation ,45.0,22.0, Instagram ,3000.0,111.0,0.037
 DreamsInWind    ,"Heart in ruins, the remnants of shattered dreams scattered in the wind. ", Ruins      ,40.0,20.0, Twitter  ,3000.0,100.0,0.03333333333333333
 DreamEchoes ,"Shattered by the echoes of a shattered dream, fragments of hope scattered. ", Desolation ,40.0,20.0, Twitter ,3000.0,100.0,0.03333333333333333
 RemorseWalker ,"Avoiding the thorns of regret, walking barefoot on the path of remorse. ", Regret ,50.0,25.0, Instagram ,3000.0,125.0,0.041666666666666664
 JoyLabyrinth ,"In the labyrinth of grief, the walls echo with the footsteps of lost joy. ", Grief ,35.0,18.0, Facebook ,3000.0,89.0,0.029666666666666668
 SolitudeSeas ,"A soul adrift in the sea of solitude, waves of loneliness crashing relentlessly. ", Loneliness ,45.0,22.0, Twitter ,3000.0,111.0,0.037
 PalateStainer ,"The bitterness of betrayal, a taste that lingers, staining the palate of trust. ", Bitterness ,30.0,15.0, Instagram ,3000.0,75.0,0.025
 HopeRuins ,"In the ruins of hope, echoes of shattered dreams whisper tales of loss. ", Desolation ,55.0,28.0, Facebook ,3000.0,139.0,0.04633333333333333
 OceanSinker ,"Sinking like a stone in the ocean of heartbreak, each ripple a sigh of despair. ", Heartbreak ,45.0,22.0, Twitter ,3000.0,111.0,0.037
 InkJournalist ,"Tears, the ink staining the pages of a journal, a testament to silent grief. ", Grief ,60.0,30.0, Instagram ,3000.0,150.0,0.05
 TrustWasteland ,"In the wasteland of lost trust, the echoes of broken promises reverberate. ", Betrayal ,50.0,25.0, Facebook ,3000.0,125.0,0.041666666666666664
 DreamTightrope ,"Avoiding the shards of shattered dreams, walking the tightrope of resilience. ", Resilience ,70.0,35.0, Twitter ,3000.0,175.0,0.058333333333333334
 EchoedLaughter ,"Suffocating in the silence of solitude, where echoes of laughter once thrived. ", Isolation ,60.0,30.0, Instagram ,3000.0,150.0,0.05
 PossibilityGhost ,"Haunted by the specter of lost possibilities, a ghost that refuses to fade away. ", Regret ,35.0,18.0, Twitter ,3000.0,89.0,0.029666666666666668
 EndlessLabyrinth ,"In the labyrinth of despair, the echoes of a broken heart reverberate endlessly. ", Despair ,55.0,28.0, Facebook ,3000.0,139.0,0.04633333333333333
 RiverOfSorrow ,"Sinking like autumn leaves in the river of sorrow, carried away by the current. ", Sorrow ,45.0,22.0, Instagram ,3000.0,111.0,0.037
 DreamGardener ,"In the garden of broken dreams, petals fall, a silent testimony to shattered hopes. ", Desolation ,40.0,20.0, Twitter ,3000.0,100.0,0.03333333333333333
 CurrencyOfTears ,"Tears, the currency of grief, spent in the marketplace of lost love and longing. ", Grief ,50.0,25.0, Facebook ,3000.0,125.0,0.041666666666666664
 MazeWanderer ,"Wandering in the maze of betrayal, the walls closing in with every wrong turn. ", Betrayal ,30.0,15.0, Instagram ,3000.0,75.0,0.025
 StormSeeker ,"A soul weathered by the storm of heartbreak, seeking refuge in the calm after. ", Heartbreak ,45.0,22.0, Twitter ,3000.0,111.0,0.037
 TapestrySorrow ,"In the tapestry of despair, threads of hope unravel, leaving a portrait of sorrow. ", Despair ,35.0,18.0, Facebook ,3000.0,89.0,0.029666666666666668
 WitheredRose ,"Like a withered rose in the garden of love, petals fall, a silent surrender to time. ", Loss ,55.0,28.0, Instagram ,3000.0,139.0,0.04633333333333333
 LoveSongEcho ,"In the void of heartache, echoes of a love song play, each note a pang of longing. ", Heartache ,60.0,30.0, Instagram ,3000.0,150.0,0.05
 MoonlitMemories ,"Nostalgia, a bittersweet dance in the moonlit ballroom of cherished memories. ", Nostalgia ,35.0,18.0, Twitter ,3000.0,89.0,0.029666666666666668
 SymphonyOfTears ,"In the symphony of grief, each tear is a note, composing a melancholic melody. ", Grief ,45.0,22.0, Facebook ,3000.0,111.0,0.037
 VenomousGarden ,"Betrayal, a venomous serpent slithering through the garden of trust, poisoning roots. ", Betrayal ,50.0,25.0, Instagram ,3000.0,125.0,0.041666666666666664
 QuicksandFighter ,"Sinking in the quicksand of despair, the harder you fight, the deeper you descend. ", Despair ,40.0,20.0, Twitter ,3000.0,100.0,0.03333333333333333
 DreamCemetery ,"Wandering through the cemetery of lost dreams, tombstones marking untold sorrows. ", Desolation ,55.0,28.0, Facebook ,3000.0,139.0,0.04633333333333333
 RegretRiver ,"Swept away by the river of regret, the currents of the past refusing to release. ", Regret ,35.0,18.0, Instagram ,3000.0,89.0,0.029666666666666668
 HeartAttic ,"Whispers of lost love linger in the attic of the heart, forgotten but not erased. ", Loss ,45.0,22.0, Twitter ,3000.0,111.0,0.037
 PromiseGallery ,"In the gallery of broken promises, each shattered vow framed, a painful exhibition. ", Betrayal ,30.0,15.0, Facebook ,3000.0,75.0,0.025
 EchoedConversation ,"The echoes of solitude, a silent conversation between a soul and its shadows. ", Solitude ,60.0,30.0, Instagram ,3000.0,150.0,0.05
 SunshineDancer ,"Dancing on sunshine, each step a celebration of the joy found in simple moments. ", Joy ,80.0,40.0, Instagram ,3000.0,200.0,0.06666666666666667
 EchoedLaughter ,"Laughter echoes in the air, a chorus of happiness that lifts the spirit higher. ", Happiness ,70.0,35.0, Twitter ,3000.0,175.0,0.058333333333333334
 GardenOfJoy ,"In the garden of contentment, each bloom whispers tales of inner peace and joy. ", Contentment ,50.0,25.0, Facebook ,3000.0,125.0,0.041666666666666664
 DreamChaser ,"Chasing dreams under the vibrant sky, a journey fueled by hope and enthusiasm. ", Enthusiasm ,60.0,30.0, Instagram ,3000.0,150.0,0.05
 StarSerenader ,"Serenading the stars with a heart full of gratitude, a melody of thankfulness. ", Gratitude ,45.0,22.0, Twitter ,3000.0,111.0,0.037
 GlowAchiever ,"Basking in the glow of accomplishment, each milestone a stepping stone to happiness. ", Accomplishment ,55.0,28.0, Facebook ,3000.0,139.0,0.04633333333333333
 DanceHarmony ,"In the dance of positivity, every step is a rhythm, uplifting the soul in harmony. ", Positivity ,35.0,18.0, Instagram ,3000.0,89.0,0.029666666666666668
 LaughterCup ,"Overflowing with joy, a cup of laughter shared with friends, a moment cherished. ", Joy ,40.0,20.0, Twitter ,3000.0,100.0,0.03333333333333333
 QuiltedCompassion ,"Draped in the warmth of kindness, a quilt of compassion stitched with love. ", Kindness ,50.0,25.0, Facebook ,3000.0,125.0,0.041666666666666664
 FriendshipGarden ,"In the garden of friendships, each bloom a testament to the beauty of camaraderie. ", Friendship ,60.0,30.0, Instagram ,3000.0,150.0,0.05
 MelodyOfLove ,"In the embrace of love, each heartbeat is a melody, dancing to the rhythm of affection. ", Love ,70.0,35.0, Twitter ,3000.0,175.0,0.058333333333333334
 ColorfulLaughter ,"Surrounded by the colors of joy, a canvas painted with laughter and endless smiles. ", Joy ,80.0,40.0, Instagram ,3000.0,200.0,0.06666666666666667
 SymphonyFervor ,"In the symphony of excitement, each note is a burst of energy, igniting the soul with fervor. ", Excitement ,60.0,30.0, Facebook ,3000.0,150.0,0.05
 WrappedDelight ,"A surprise gift, wrapped in anticipation, unfolds a moment of delight and wonder. ", Surprise ,50.0,25.0, Twitter ,3000.0,125.0,0.041666666666666664
 MazeDiscovery ,"Lost in the maze of curiosity, each twist and turn unveils the treasures of discovery. ", Curiosity ,45.0,22.0, Instagram ,3000.0,111.0,0.037
 CloudsOfBlessings ,"Floating on clouds of gratitude, each raindrop a blessing, a shower of thankfulness. ", Gratitude ,55.0,28.0, Facebook ,3000.0,139.0,0.04633333333333333
 CometCreativity ,"Like a comet of inspiration, streaking through the sky of creativity, leaving trails of brilliance. ", Inspiration ,35.0,18.0, Twitter ,3000.0,89.0,0.029666666666666668
 FireworksTriumph ,"In the celebration of success, fireworks of accomplishment light up the night sky of triumph. ", Success ,45.0,22.0, Instagram ,3000.0,111.0,0.037
 LaughterSymphony ,"A symphony of laughter, each note a key to unlocking the door of boundless happiness. ", Happiness ,60.0,30.0, Facebook ,3000.0,150.0,0.05
