influencer,comment,sentiment,likes,shares,platform,cost,engagement,roi
 EmotionCarnival ,"In the carnival of emotions, the rollercoaster of thrill sends the heart on a wild ride. ", Thrill ,70.0,35.0, Instagram ,3000.0,175.0,0.058333333333333334
 ParisDreamer ,"Standing before the grandeur of the Eiffel Tower, a moment to reflect on the beauty of Parisian dreams. ", Reflection ,55.0,28.0, Twitter ,3000.0,139.0,0.04633333333333333
 DisneylandExplorer ,"Lost in the enchantment of Disneyland, each ride a journey into the realm of childhood fantasies. ", Enchantment ,60.0,30.0, Instagram ,3000.0,150.0,0.05
 FerrariSpeedster ,"Exploring the wonders of Ferrari World, the roar of engines creating a symphony of speed. ", Excitement ,45.0,22.0, Facebook ,3000.0,111.0,0.037
 KeukenhofAdventurer ,"Amidst the tulip fields of Keukenhof, a tapestry of colors that paints the soul with springtime joy. ", Joy ,70.0,35.0, Instagram ,3000.0,175.0,0.058333333333333334
 KyotoAdventurer ,"Wandering through the historical streets of Kyoto, each step a journey into the heart of Japan's traditions. ", Exploration ,35.0,18.0, Twitter ,3000.0,89.0,0.029666666666666668
 CanyonMarveler ,"In the embrace of the Grand Canyon, nature's masterpiece, a moment to marvel at Earth's grandeur. ", Awe ,50.0,25.0, Instagram ,3000.0,125.0,0.041666666666666664
 SantoriniTraveler ,"Journeying through the serenity of Santorini, where each sunset paints the sky with hues of tranquility. ", Serenity ,45.0,22.0, Facebook ,3000.0,111.0,0.037
 PetraExplorer ,"Amazed by the architectural marvels of Petra, each stone telling tales of an ancient civilization. ", Amazement ,60.0,30.0, Twitter ,3000.0,150.0,0.05
 VeniceRomantic ,"Embarking on a gondola ride in Venice, each canal reflecting the romance of this timeless city. ", Romance ,40.0,20.0, Instagram ,3000.0,100.0,0.03333333333333333
 MachuPicchuAdventurer ,"At the summit of Machu Picchu, a breathtaking panorama that whispers the secrets of ancient civilizations. ", Awe ,55.0,28.0, Facebook ,3000.0,139.0,0.04633333333333333
 TimesSquareExplorer ,"In the heart of New York City, Times Square dazzles with lights, a vibrant spectacle of urban energy. ", Excitement ,70.0,35.0, Instagram ,3000.0,175.0,0.058333333333333334
 ColosseumAdventurer ,"Captivated by the historical charm of the Colosseum, each stone echoing tales of gladiator valor. ", Captivation ,50.0,25.0, Twitter ,3000.0,125.0,0.041666666666666664
 MaldivesSailor ,"Sailing the azure waters of the Maldives, each wave a whisper of serenity in paradise. ", Serenity ,45.0,22.0, Facebook ,3000.0,111.0,0.037
 AmazonExplorer ,"In the midst of the Amazon rainforest, a symphony of wildlife creates an orchestra of nature's wonders. ", Wonder ,60.0,30.0, Instagram ,3000.0,150.0,0.05
 GreatWallWalker ,"Walking the Great Wall of China, each step a testament to ancient engineering marvels. ", Awe ,35.0,18.0, Twitter ,3000.0,89.0,0.029666666666666668
 FujiSummitAchiever ,"At the summit of Mount Fuji, a breathtaking sunrise that paints the sky with hues of accomplishment. ", Accomplishment ,55.0,28.0, Facebook ,3000.0,139.0,0.04633333333333333
 AngkorWatAdventurer ,"Exploring the ancient ruins of Angkor Wat, each stone whispering stories of Khmer civilization. ", Exploration ,40.0,20.0, Instagram ,3000.0,100.0,0.03333333333333333
 AlpsSkiAdventurer ,"Skiing down the slopes of the Swiss Alps, each turn a dance with the majesty of snow-capped peaks. ", Adventure ,45.0,22.0, Twitter ,3000.0,111.0,0.037
 KyotoBambooSeeker ,"In the tranquility of Kyoto's bamboo forest, whispers of ancient Zen wisdom echo through the groves. ", Tranquility ,50.0,25.0, Facebook ,3000.0,125.0,0.041666666666666664
 NorwayFjordExplorer ,"Cruising the fjords of Norway, each icy landscape a breathtaking masterpiece of nature's grandeur. ", Grandeur ,45.0,22.0, Instagram ,3000.0,111.0,0.037
 AdeleConcertGoer ,"At the front row of Adele's concert, each note of 'Someone Like You' resonates with soul-stirring emotion. ", Emotion ,80.0,40.0, Instagram ,3000.0,200.0,0.06666666666666667
 BeyonceDancer ,"Dancing under the stars at Beyoncé's live show, feeling the power of 'Single Ladies' in every move. ", Energy ,70.0,35.0, Twitter ,3000.0,175.0,0.058333333333333334
 SwiftieDreamer ,"In the crowd of a Taylor Swift concert, the lyrics of 'Love Story' create an enchanting fairy tale. ", Enchantment ,60.0,30.0, Facebook ,3000.0,150.0,0.05
 QueenTributeFan ,"Rocking out to the guitar solos at a Queen tribute concert, a journey back in time with Freddie's spirit. ", Nostalgia ,45.0,22.0, Instagram ,3000.0,111.0,0.037
 SheeranMelodyLover ,"Swaying to Ed Sheeran's acoustic melodies, a serene evening filled with 'Perfect' moments. ", Serenity ,35.0,18.0, Twitter ,3000.0,89.0,0.029666666666666668
 MarsJoyExplorer ,"Immersed in the pulsating beats of a Bruno Mars concert, where 'Uptown Funk' becomes a city of joy. ", Joy ,55.0,28.0, Facebook ,3000.0,139.0,0.04633333333333333
 MJTributeDancer ,"At a Michael Jackson tribute show, moonwalking through the hits, a celebration of the King of Pop. ", Celebration ,50.0,25.0, Instagram ,3000.0,125.0,0.041666666666666664
 SinatraCharmListener ,"Swinging to the rhythms of a Frank Sinatra tribute, feeling the timeless charm of 'Fly Me to the Moon'. ", Charm ,45.0,22.0, Twitter ,3000.0,111.0,0.037
 MetallicaMoshWarrior ,"In the mosh pit of a Metallica concert, the thunderous chords create a symphony of headbanging ecstasy. ", Ecstasy ,70.0,35.0, Facebook ,3000.0,175.0,0.058333333333333334
 ColdplayHopeSeeker ,"Experiencing the magic of a Coldplay concert, where 'Fix You' becomes a beacon of hope in the night. ", Hope ,60.0,30.0, Instagram ,3000.0,150.0,0.05
 BieberDanceEnthusiast ,"At a Justin Bieber concert, the infectious beats of 'Baby' create a dance floor of unbridled enthusiasm. ", Enthusiasm ,80.0,40.0, Instagram ,3000.0,200.0,0.06666666666666667
 GagaArtisticChameleon ,"In the spotlight at a Lady Gaga show, each costume change is a metamorphosis of creativity and artistry. ", Creativity ,70.0,35.0, Twitter ,3000.0,175.0,0.058333333333333334
 AdeleMelodyTearjerker ,"Immersed in the soulful melodies of Adele, tears flow freely, moved by the emotion of 'Hello'. ", Emotion ,60.0,30.0, Facebook ,3000.0,150.0,0.05
 KatyPerryColorExplosion ,"Drenched in confetti at a Katy Perry concert, a kaleidoscope of colors igniting the night sky. ", Colorful ,45.0,22.0, Instagram ,3000.0,111.0,0.037
 JayZEmpireListener ,"In the audience of a Jay-Z performance, the lyrics of 'Empire State of Mind' become an anthem of pride. ", Pride ,35.0,18.0, Twitter ,3000.0,89.0,0.029666666666666668
 ShakiraHipsDancer ,"Dancing to Shakira's rhythmic beats, hips swaying to the hypnotic charm of 'Hips Don't Lie'. ", Hypnotic ,55.0,28.0, Facebook ,3000.0,139.0,0.04633333333333333
 U2ConnectionSeeker ,"At a U2 concert, the anthemic chords of 'With or Without You' create a timeless moment of connection. ", Connection ,50.0,25.0, Instagram ,3000.0,125.0,0.041666666666666664
 GunsNRosesRiffRockstar ,"Rocking out at a Guns N' Roses show, the iconic riffs of 'Sweet Child o' Mine' echoing in the night. ", Iconic ,45.0,22.0, Twitter ,3000.0,111.0,0.037
 ArianaEuphoriaChaser ,"In the crowd of an Ariana Grande concert, the high notes of 'Into You' create a euphoric symphony. ", Euphoria ,70.0,35.0, Facebook ,3000.0,175.0,0.058333333333333334
 MarleyReggaeTraveler ,"Swaying to the reggae vibes of Bob Marley's tribute concert, each chord a journey to Jamaica's soul. ", Journey ,60.0,30.0, Instagram ,3000.0,150.0,0.05
 MovieEnthusiastPremiereAttendee ,"Captivated by the spellbinding plot twists, the audience applauds, experiencing a rollercoaster of emotions at the movie premiere. ", Excitement ,80.0,40.0, Twitter ,3000.0,200.0,0.06666666666666667
 FilmLoverNostalgiaSeeker ,"As the credits roll, a profound sense of nostalgia washes over, reminiscent of cherished moments in classic films. ", Nostalgia ,70.0,35.0, Instagram ,3000.0,175.0,0.058333333333333334
 WebSeriesViewerCharacterConnection ,"Streaming the latest web series, the viewer is engrossed in the characters' journey, feeling a sense of connection and empathy. ", Engagement ,60.0,30.0, Facebook ,3000.0,150.0,0.05
 IndieFilmmakerFestivalSuccess ,"At the film festival, the indie filmmaker's creation receives a standing ovation, evoking pride and a sense of accomplishment. ", Pride ,45.0,22.0, Twitter ,3000.0,111.0,0.037
 DramaEnthusiastHeartwarmingMoments ,"Watching a heartwarming family drama, tears flow freely as the characters overcome challenges, leaving the viewer with a warm glow. ", Touched ,55.0,28.0, Instagram ,3000.0,139.0,0.04633333333333333
 AwardWinningActorOscarsRecipient ,"At the Oscars, the actor graciously accepts an award, radiating joy and gratitude for the recognition of their outstanding performance. ", Gratitude ,35.0,18.0, Facebook ,3000.0,89.0,0.029666666666666668
 DocumentaryEnthusiastHiddenGemFinder ,"Discovering a hidden gem in the world of documentaries, the viewer is enlightened and inspired, feeling a renewed sense of curiosity. ", Inspiration ,45.0,22.0, Twitter ,3000.0,111.0,0.037
 FilmBuffContemplativeViewer ,"As the movie credits roll, the viewer experiences a mix of awe and contemplation, pondering the deeper meanings woven into the storyline. ", Contemplation ,55.0,28.0, Instagram ,3000.0,139.0,0.04633333333333333
 CrimeSeriesEnthusiastThrillSeeker ,"Binge-watching a thrilling crime series, the suspense keeps the viewer on the edge of their seat, creating a rush of adrenaline. ", Suspense ,70.0,35.0, Facebook ,3000.0,175.0,0.058333333333333334
 FilmCriticSatisfactionSeeker ,"As the closing scene unfolds, a sense of satisfaction washes over, completing the cinematic journey with a profound and fulfilling ending. ", Satisfaction ,45.0,22.0, Twitter ,3000.0,111.0,0.037
 FootballFanWorldCupCelebration ,"Celebrating a historic victory in the World Cup, the nation erupts in joy, united by the triumph of their football team. ", Joy ,80.0,40.0, Instagram ,3000.0,200.0,0.06666666666666667
 OlympicsEnthusiastGoldMedalWinner ,"At the Olympics, the athlete's perseverance shines through, earning a gold medal and inspiring a generation with their remarkable achievement. ", Inspiration ,70.0,35.0, Twitter ,3000.0,175.0,0.058333333333333334
 CricketFanChampionshipThrills ,"In the cricket championship, a nail-biting finish leaves fans on the edge of their seats, experiencing a rollercoaster of emotions. ", Excitement ,60.0,30.0, Facebook ,3000.0,150.0,0.05
 MarathonSpectatorRecordBreaking ,"Witnessing a record-breaking marathon, spectators are filled with awe and admiration for the endurance and dedication of the runners. ", Admiration ,45.0,22.0, Instagram ,3000.0,111.0,0.037
 TennisEnthusiastGrandSlamDrama ,"In the tennis grand slam, a fierce rivalry unfolds, captivating fans with a display of skill and sportsmanship on the world stage. ", Captivation ,55.0,28.0, Twitter ,3000.0,139.0,0.04633333333333333
 BasketballFanUnderdogTriumph ,"Cheering for the underdog in the basketball finals, the crowd erupts in applause as the team defies odds to claim the championship title. ", Triumph ,35.0,18.0, Facebook ,3000.0,89.0,0.029666666666666668
 GolfEnthusiastPrecisionVictory ,"At the golf tournament, the golfer's precision and focus lead to a stunning victory, leaving spectators in awe of their exceptional skill. ", Awe ,45.0,22.0, Instagram ,3000.0,111.0,0.037
 F1FanHighSpeedRaceExcitement ,"Experiencing the thrill of a high-speed Formula 1 race, fans are on the edge of their seats as drivers compete for the championship. ", Thrill ,55.0,28.0, Twitter ,3000.0,139.0,0.04633333333333333
 CyclingEnthusiastWorldChampion ,"In the cycling world championship, the climber conquers challenging terrains, symbolizing determination and achievement against all odds. ", Determination ,70.0,35.0, Facebook ,3000.0,175.0,0.058333333333333334
 HockeyFanComebackVictory ,"Witnessing a heartwarming comeback in the hockey finals, fans share tears of joy as the team secures a historic victory after adversity. ", Heartwarming ,45.0,22.0, Instagram ,3000.0,111.0,0.037
 SoccerFanTeamDefeats ,"After a series of defeats, the soccer team faces disappointment, struggling to find the silver lining in a challenging season. ", Disappointment ,80.0,40.0, Twitter ,3000.0,200.0,0.06666666666666667
 TennisEnthusiastUnexpectedSetback ,"In the tennis tournament, a highly anticipated player experiences a setback, leaving fans in shock and questioning the unforeseen turn of events. ", Frustration ,70.0,35.0, Instagram ,3000.0,175.0,0.058333333333333334
 BoxingFanChampionshipDefeat ,"Facing a defeat in the championship, the boxer reflects on the challenges, vowing to return stronger and more determined in the next bout. ", Reflection ,60.0,30.0, Facebook ,3000.0,150.0,0.05
 CyclingEnthusiastTireBlowout ,"In the midst of a cycling race, a tire blowout leads to frustration for the cyclist, who valiantly tries to overcome the unexpected obstacle. ", Obstacle ,45.0,22.0, Twitter ,3000.0,111.0,0.037
 GymnasticsFanRoutineFall ,"The gymnast's unexpected fall during a routine sparks a wave of sympathy from the audience, highlighting the vulnerability of sports. ", Sympathy ,55.0,28.0, Instagram ,3000.0,139.0,0.04633333333333333
 GolfEnthusiastMissedPutt ,"In the golf tournament, a missed crucial putt results in defeat, causing the golfer to reflect on the pressure of high-stakes competition. ", Pressure ,35.0,18.0, Facebook ,3000.0,89.0,0.029666666666666668
 BasketballFanTeamLosses ,"Experiencing a series of losses in the basketball season, the team grapples with frustration, determined to turn the tide with renewed effort. ", Renewed Effort ,45.0,22.0, Twitter ,3000.0,111.0,0.037
 SwimmingEnthusiastRaceSetback ,"Despite meticulous training, the swimmer faces disappointment as a split-second miscalculation costs them the lead in a crucial race. ", Miscalculation ,55.0,28.0, Instagram ,3000.0,139.0,0.04633333333333333
 WeightliftingFanFailedRecord ,"The weightlifter's failed attempt at a personal record results in frustration, highlighting the challenging nature of pushing physical limits. ", Challenge ,70.0,35.0, Facebook ,3000.0,175.0,0.058333333333333334
 SoccerPlayerOwnGoalMoment ,"In the midst of a soccer match, an unexpected own goal creates a moment of despair for the player, as teammates console and encourage them. ", Despair ,45.0,22.0, Twitter ,3000.0,111.0,0.037
 NatureEnthusiastSunsetWonder ,"In the serene beauty of a sunset, nature unfolds a canvas of colors, evoking a sense of tranquility and wonder. ", Tranquility ,80.0,40.0, Instagram ,3000.0,200.0,0.06666666666666667
 TravelEnthusiastRoadTripDiscovery ,"Embarking on a spontaneous road trip, the traveler discovers hidden gems, creating memories that will be cherished for a lifetime. ", Adventure ,70.0,35.0, Twitter ,3000.0,175.0,0.058333333333333334
 UrbanExplorerCafeSolitude ,"Amidst the bustling city, a quiet café becomes a sanctuary for reflection, where a cup of coffee brings solace to the wandering mind. ", Solace ,60.0,30.0, Facebook ,3000.0,150.0,0.05
 ArtEnthusiastStreetArtExploration ,"Exploring the vibrant street art of a cultural neighborhood, each mural tells a story, infusing the city with creativity and expression. ", Creativity ,45.0,22.0, Instagram ,3000.0,111.0,0.037
 ScienceEnthusiastDiscoveryMoment ,"In the world of science, a breakthrough discovery unfolds, pushing the boundaries of knowledge and opening new frontiers of exploration. ", Breakthrough ,55.0,28.0, Twitter ,3000.0,139.0,0.04633333333333333
 MusicLoverLiveOrchestraExperience ,"Connecting with the melody of a live orchestra, the music enthusiast experiences a symphony that resonates deep within the soul. ", Harmony ,35.0,18.0, Facebook ,3000.0,89.0,0.029666666666666668
 HomeBakerDeliciousMemories ,"Embracing the aroma of freshly baked bread, the home chef finds joy in the art of baking, creating delicious memories for loved ones. ", Joy in Baking ,45.0,22.0, Instagram ,3000.0,111.0,0.037
 HistoryBuffMuseumExploration ,"Wandering through a historical museum, the history enthusiast becomes immersed in the tales of the past, envisioning bygone eras. ", Envisioning History ,55.0,28.0, Twitter ,3000.0,139.0,0.04633333333333333
 BookwormCaptivatingNovelEscape ,"In the realm of literature, a captivating novel transports the reader to distant lands, weaving a tapestry of imagination and escape. ", Imagination ,70.0,35.0, Facebook ,3000.0,175.0,0.058333333333333334
 PhotographyEnthusiastMarketMoments ,"Capturing the essence of a bustling market, the photographer freezes moments in time, each frame telling a unique and vibrant story. ", Vibrancy ,45.0,22.0, Instagram ,3000.0,111.0,0.037
 DanceEnthusiastCityNightPerformance ,"Underneath the city lights, the dancer expresses emotions through graceful movements, creating a mesmerizing performance under the night sky. ", Mesmerizing ,80.0,40.0, Twitter ,3000.0,200.0,0.06666666666666667
 FoodieMarketStreetFoodExploration ,"In the heart of a bustling market, the street food connoisseur indulges in a culinary adventure, savoring diverse flavors and aromas. ", Culinary Adventure ,70.0,35.0, Instagram ,3000.0,175.0,0.058333333333333334
 SnowLoverWinterEnthusiast ,"As the first snowflake descends, the winter enthusiast eagerly prepares for a season of frosty delights, anticipating the magic of snow-covered landscapes. ", Winter Magic ,60.0,30.0, Facebook ,3000.0,150.0,0.05
 MysteryBookwormSuspensefulRead ,"Amidst the pages of a captivating mystery novel, the reader unravels clues and secrets, experiencing a thrilling journey of suspense and revelation. ", Thrilling Journey ,45.0,22.0, Twitter ,3000.0,111.0,0.037
 GardeningEnthusiastFlowerGarden ,"Surrounded by the vibrant colors of a flower garden, the gardener nurtures blossoms, finding joy in the beauty of nature's ever-changing canvas. ", Nature's Beauty ,55.0,28.0, Instagram ,3000.0,139.0,0.04633333333333333
 AstronomyEnthusiastStargazing ,"At the astronomy observatory, the stargazer marvels at the vastness of the cosmos, contemplating the mysteries hidden within the celestial expanse. ", Celestial Wonder ,35.0,18.0, Facebook ,3000.0,89.0,0.029666666666666668
 CoffeeLoverWritersRetreat ,"Engulfed in the aroma of freshly brewed coffee, the writer finds inspiration in every sip, embarking on a journey of creativity and prose. ", Creative Inspiration ,45.0,22.0, Twitter ,3000.0,111.0,0.037
 FashionEnthusiastDesignerShowcase ,"In the realm of fashion, the designer unveils a collection that tells a story, blending innovation and tradition on the runway of creativity. ", Runway Creativity ,55.0,28.0, Instagram ,3000.0,139.0,0.04633333333333333
 SurfingEnthusiastWaveRider ,"As the waves crash against the shore, the surfer embraces the thrill of riding the ocean's energy, capturing the essence of freedom in each wave. ", Ocean's Freedom ,45.0,22.0, Facebook ,3000.0,111.0,0.037
 HistoryExplorerAncientCityTour ,"Exploring the historical architecture of an ancient city, the traveler is transported to a bygone era, where each monument whispers tales of the past. ", Whispers of the Past ,70.0,35.0, Twitter ,3000.0,175.0,0.058333333333333334
 CrushAvoider ,Successfully avoided eye contact with my crush in the hallway. Mission accomplished. #TeenCrush #StealthMode , Excitement ,30.0,15.0, Twitter ,3000.0,75.0,0.025
 MovieBuff ,Ran out of snacks during a movie marathon. Crisis level: Emergency! #MovieNightStruggles #TeenProblems , Boredom ,35.0,18.0, Instagram ,3000.0,89.0,0.029666666666666668
 SelfieAddict ,Spent an hour choosing the perfect filter for a selfie. The struggle for that Instagram aesthetic is real. #SelfieQueen #TeenVibes , Joy ,45.0,22.0, Facebook ,3000.0,111.0,0.037
 AudioExplorer ,Lost my headphones again. How do they vanish into thin air? #HeadphoneMystery #TeenLife , Frustration ,40.0,20.0, Twitter ,3000.0,100.0,0.03333333333333333
 MemeCreator ,Decided to study for exams but ended up making memes about studying instead. Procrastination level: Expert. #ProcrastinationNation #TeenConfessions , Surprise ,50.0,25.0, Instagram ,3000.0,125.0,0.041666666666666664
 FashionBlunder ,"Got dressed for the day, then remembered it's Saturday. Oops. #WeekendVibes #TeenStruggles ", Indifference ,40.0,20.0, Facebook ,3000.0,100.0,0.03333333333333333
 GroupGenius ,Survived a group project without any drama. Miracles do happen. #GroupProjectSuccess #TeenAchievements , Satisfaction ,55.0,28.0, Twitter ,3000.0,139.0,0.04633333333333333
 ChipExplorer ,"Entered the kitchen with the intention to cook. Left with a bag of chips. Cooking is overrated, anyway. #MasterChefInTraining #TeenHumor ", Disgust ,45.0,22.0, Instagram ,3000.0,111.0,0.037
 ExcitementSeeker ,"Staring at the clock in class, waiting for the bell to ring like it's the most exciting event of the day. #ClassCountdown #TeenLife ", Surprise ,35.0,18.0, Facebook ,3000.0,89.0,0.029666666666666668
 NightReader ,"Discovered a new book series and spent the whole night reading. Who needs sleep, anyway? #BookwormLife #LateNightReading ", Joy ,60.0,30.0, Twitter ,3000.0,150.0,0.05
 GamingEnthusiast ,"Bought a new video game, played for hours, forgot to eat. The ultimate gaming session. #GamerLife #NoFoodGaming ", Excitement ,45.0,22.0, Instagram ,3000.0,111.0,0.037
 LazyWatcher ,Spent the day binge-watching a new series. Productivity level: Zero. #LazyDay #TVSeriesMarathon , Joy ,70.0,35.0, Facebook ,3000.0,175.0,0.058333333333333334
 TrendExplorer ,Caught up on the latest fashion trends and now planning a shopping spree. #Fashionista #TrendyTeen , Excitement ,40.0,20.0, Twitter ,3000.0,100.0,0.03333333333333333
 MusicalExplorer ,Decided to learn a new instrument. Day one: Still trying to figure out how to hold it. #MusicNovice #LearningJourney , Frustration ,55.0,28.0, Instagram ,3000.0,139.0,0.04633333333333333
 MusicAficionado ,Spent hours creating the perfect playlist for every mood. Music is my therapy. #PlaylistMaker #TeenMusicLover , Joy ,45.0,22.0, Facebook ,3000.0,111.0,0.037
 HomeChef ,Successfully cooked a gourmet meal for the family. Chef skills unlocked! #ChefMode #TeenChef , Pride ,50.0,25.0, Twitter ,3000.0,125.0,0.041666666666666664
 AdventureSeeker ,Spontaneously booked a weekend getaway. Adventure awaits! #TravelBug #WeekendEscape , Excitement ,35.0,18.0, Instagram ,3000.0,89.0,0.029666666666666668
 DanceEnthusiast ,Attended a concert and danced the night away. Music is the heartbeat of life. #ConcertVibes #DanceAllNight , Joy ,55.0,28.0, Facebook ,3000.0,139.0,0.04633333333333333
 NostalgiaExplorer ,Rediscovered childhood cartoons and had a nostalgia-filled marathon. #CartoonNostalgia #TeenMemories , Joy ,45.0,22.0, Twitter ,3000.0,111.0,0.037
 HomeDecorator ,Embarked on a DIY home decor project. Let's hope it turns out better than last time. #DIYAdventure #TeenHomeDecor , Excitement ,70.0,35.0, Instagram ,3000.0,175.0,0.058333333333333334
 ArtExplorer ,"Spent the afternoon at a museum, pretending to be cultured. Art enthusiast in the making. #MuseumDay #TeenArtLover ", Curiosity ,40.0,20.0, Facebook ,3000.0,100.0,0.03333333333333333
 ThoughtfulBlogger ,Started a blog about random thoughts and musings. Blogging is the new diary. #BloggerLife #TeenBlogger , Curiosity ,60.0,30.0, Twitter ,3000.0,150.0,0.05
 NovelEnthusiast ,Relishing a peaceful afternoon with a classic novel. Quiet moments are the best moments. #BookLover #PeacefulAfternoon , Contentment ,70.0,35.0, Instagram ,3000.0,175.0,0.058333333333333334
 WiseSoul ,"Reflecting on a lifetime of memories, each wrinkle tells a story. Embracing the beauty of aging. #LifeReflections #BeautyInAging ", Gratitude ,55.0,28.0, Twitter ,3000.0,139.0,0.04633333333333333
 ArtAdventurer ,Exploring the world of digital art. It's never too late to discover new passions. #DigitalArtistry #LateBloomer , Curiosity ,45.0,22.0, Facebook ,3000.0,111.0,0.037
 HomeChefSenior ,Savoring the flavors of a home-cooked meal. Simple joys are the heart of happiness. #HomeCooking #SimpleJoys , Contentment ,50.0,25.0, Instagram ,3000.0,125.0,0.041666666666666664
 LinguisticExplorer ,Embarking on a journey of learning a new language. The mind stays young with every new word. #LanguageLearning #NeverTooLate , Curiosity ,60.0,30.0, Twitter ,3000.0,150.0,0.05
 MusicConnoisseur ,"Attended a classical music concert, feeling the timeless melodies resonate. Music transcends generations. #ClassicalMusic #TimelessMelodies ", Joy ,35.0,18.0, Facebook ,3000.0,89.0,0.029666666666666668
 PhotographySenior ,Capturing the beauty of nature through photography. Every snapshot is a treasure. #NaturePhotography #SeniorPhotographer , Joy ,70.0,35.0, Instagram ,3000.0,175.0,0.058333333333333334
 TeaTimeSenior ,"Reconnecting with old friends over a cup of tea. Friendship, the true essence of companionship. #OldFriends #Companionship ", Contentment ,55.0,28.0, Twitter ,3000.0,139.0,0.04633333333333333
 RoadTripSenior ,"Embarked on a road trip to revisit cherished places from the past. Nostalgia, the ultimate travel companion. #RoadTrip #NostalgiaTour ", Joy ,45.0,22.0, Facebook ,3000.0,111.0,0.037
 ChoirEnthusiast ,"Joined a community choir, harmonizing with fellow voices. Music creates bonds that withstand time. #CommunityChoir #HarmonyInAging ", Joy ,40.0,20.0, Instagram ,3000.0,100.0,0.03333333333333333
 MeditationSenior ,"Exploring the art of meditation, finding tranquility in the stillness of the mind. #MeditationJourney #TranquilMind ", Contentment ,35.0,18.0, Twitter ,3000.0,89.0,0.029666666666666668
 GardenEnthusiast ,"Taking a stroll in the garden, appreciating the beauty of blooming flowers. Nature's wonders never cease. #GardenWalk #FloralBeauty ", Contentment ,50.0,25.0, Facebook ,3000.0,125.0,0.041666666666666664
